{
  "$schema": "../../schemas/arena.schema.json",
  "id": "classroom_expanded",
  "name": "拡張教室（2倍スケール）",
  "scale": 2.0,
  "bounds": {
    "x": 18.0,
    "y": 6.0,
    "z": 16.0
  },
  "colliders": [
    {
      "type": "box",
      "pos": [
        0,
        3.0,
        -8.2
      ],
      "size": [
        18.0,
        6.0,
        0.4
      ],
      "tag": "wall_blackboard"
    },
    {
      "type": "box",
      "pos": [
        0,
        3.0,
        8.2
      ],
      "size": [
        18.0,
        6.0,
        0.4
      ],
      "tag": "wall_back"
    },
    {
      "type": "box",
      "pos": [
        -9.2,
        3.0,
        0
      ],
      "size": [
        0.4,
        6.0,
        16.0
      ],
      "tag": "wall_corridor"
    },
    {
      "type": "box",
      "pos": [
        9.2,
        3.0,
        0
      ],
      "size": [
        0.4,
        6.0,
        16.0
      ],
      "tag": "wall_window"
    },
    {
      "type": "box",
      "pos": [
        0,
        0.7,
        -6.6
      ],
      "size": [
        3.0,
        1.4,
        1.2
      ],
      "tag": "teacher_desk"
    },
    {
      "type": "box",
      "pos": [
        -8.0,
        1.2,
        6.0
      ],
      "size": [
        2.0,
        2.4,
        3.2
      ],
      "tag": "cleaning_locker"
    },
    {
      "type": "box",
      "pos": [
        7.6,
        1.2,
        -5.0
      ],
      "size": [
        2.4,
        2.4,
        4.0
      ],
      "tag": "locker_block"
    },
    {
      "type": "box",
      "pos": [
        8.6,
        1.6,
        2.0
      ],
      "size": [
        0.3,
        3.2,
        6.0
      ],
      "tag": "curtain",
      "penetrable": true,
      "hp": 0
    }
  ],
  "cover": {
    "source": "seat_grid",
    "deskSize": [
      1.3,
      1.05,
      0.9
    ]
  },
  "attackerSpawns": [
    [
      -5.2,
      0.0,
      7.1
    ],
    [
      -2.6,
      0.0,
      7.2
    ],
    [
      5.2,
      0.0,
      7.1
    ]
  ],
  "spawnFlipWhenDefenderRow": {
    "gte": 3
  },
  "highGround": [
    {
      "type": "box",
      "pos": [
        7.6,
        2.5,
        -5.0
      ],
      "size": [
        2.4,
        0.2,
        4.0
      ],
      "tag": "locker_top"
    },
    {
      "type": "box",
      "pos": [
        -8.0,
        2.5,
        6.0
      ],
      "size": [
        2.0,
        0.2,
        3.2
      ],
      "tag": "cleaning_locker_top"
    }
  ],
  "waypoints": [
    {
      "id": "wp_front_l",
      "pos": [
        -6.5,
        0.0,
        -6.0
      ],
      "links": [
        "wp_front_cl",
        "wp_mid_l"
      ],
      "cover": true,
      "role": "defender"
    },
    {
      "id": "wp_front_cl",
      "pos": [
        -2.2,
        0.0,
        -6.0
      ],
      "links": [
        "wp_front_cr",
        "wp_front_l",
        "wp_mid_cl"
      ],
      "cover": false,
      "role": "defender"
    },
    {
      "id": "wp_front_cr",
      "pos": [
        2.2,
        0.0,
        -6.0
      ],
      "links": [
        "wp_front_r",
        "wp_front_cl",
        "wp_mid_cr"
      ],
      "cover": false,
      "role": "defender"
    },
    {
      "id": "wp_front_r",
      "pos": [
        6.5,
        0.0,
        -6.0
      ],
      "links": [
        "wp_front_cr",
        "wp_mid_r"
      ],
      "cover": true,
      "role": "defender"
    },
    {
      "id": "wp_mid_l",
      "pos": [
        -6.5,
        0.0,
        -2.0
      ],
      "links": [
        "wp_mid_cl",
        "wp_back_l",
        "wp_front_l"
      ],
      "cover": true,
      "role": "any"
    },
    {
      "id": "wp_mid_cl",
      "pos": [
        -2.2,
        0.0,
        -2.0
      ],
      "links": [
        "wp_mid_cr",
        "wp_mid_l",
        "wp_back_cl",
        "wp_front_cl"
      ],
      "cover": true,
      "role": "any"
    },
    {
      "id": "wp_mid_cr",
      "pos": [
        2.2,
        0.0,
        -2.0
      ],
      "links": [
        "wp_mid_r",
        "wp_mid_cl",
        "wp_back_cr",
        "wp_front_cr"
      ],
      "cover": true,
      "role": "any"
    },
    {
      "id": "wp_mid_r",
      "pos": [
        6.5,
        0.0,
        -2.0
      ],
      "links": [
        "wp_mid_cr",
        "wp_back_r",
        "wp_front_r"
      ],
      "cover": true,
      "role": "any"
    },
    {
      "id": "wp_back_l",
      "pos": [
        -6.5,
        0.0,
        2.0
      ],
      "links": [
        "wp_back_cl",
        "wp_rear_l",
        "wp_mid_l"
      ],
      "cover": true,
      "role": "any"
    },
    {
      "id": "wp_back_cl",
      "pos": [
        -2.2,
        0.0,
        2.0
      ],
      "links": [
        "wp_back_cr",
        "wp_back_l",
        "wp_rear_cl",
        "wp_mid_cl"
      ],
      "cover": true,
      "role": "any"
    },
    {
      "id": "wp_back_cr",
      "pos": [
        2.2,
        0.0,
        2.0
      ],
      "links": [
        "wp_back_r",
        "wp_back_cl",
        "wp_rear_cr",
        "wp_mid_cr"
      ],
      "cover": true,
      "role": "any"
    },
    {
      "id": "wp_back_r",
      "pos": [
        6.5,
        0.0,
        2.0
      ],
      "links": [
        "wp_back_cr",
        "wp_rear_r",
        "wp_mid_r"
      ],
      "cover": true,
      "role": "any"
    },
    {
      "id": "wp_rear_l",
      "pos": [
        -6.5,
        0.0,
        6.0
      ],
      "links": [
        "wp_rear_cl",
        "wp_back_l"
      ],
      "cover": true,
      "role": "attacker"
    },
    {
      "id": "wp_rear_cl",
      "pos": [
        -2.2,
        0.0,
        6.0
      ],
      "links": [
        "wp_rear_cr",
        "wp_rear_l",
        "wp_back_cl"
      ],
      "cover": false,
      "role": "attacker"
    },
    {
      "id": "wp_rear_cr",
      "pos": [
        2.2,
        0.0,
        6.0
      ],
      "links": [
        "wp_rear_r",
        "wp_rear_cl",
        "wp_back_cr"
      ],
      "cover": false,
      "role": "attacker"
    },
    {
      "id": "wp_rear_r",
      "pos": [
        6.5,
        0.0,
        6.0
      ],
      "links": [
        "wp_rear_cr",
        "wp_back_r"
      ],
      "cover": true,
      "role": "attacker"
    }
  ],
  "genesisTimeline": "genesis_default"
}
